{"apiVersion":"patroni.pgsty.com/v1alpha1","kind":"ClusterDiscovery","metadata":{"requestId":"machine-schema-example","observedAt":"2026-07-13T12:34:56Z","warnings":[]},"data":{"clusters":[{"target":{"context":"default","namespace":"/service","scope":"alpha","group":1,"member":"node-a"},"discoveryState":"DISCOVERED","managementState":"EXPLICIT","reachabilityState":"REACHABLE","healthState":"HEALTHY","revision":1,"memberCount":1,"leader":"node-a"}]}}
