{"apiVersion":"patroni.pgsty.com/v1alpha1","kind":"ClusterDiscovery","metadata":{"requestId":"cli-operation-1","observedAt":"2026-07-13T12:34:56Z","warnings":[]},"data":{"clusters":[{"target":{"context":"lab","namespace":"/service","scope":"alpha"},"discoveryState":"DISCOVERED","managementState":"UNMANAGED","reachabilityState":"UNKNOWN","healthState":"UNKNOWN","revision":8,"memberCount":2,"leader":"node-a"},{"target":{"context":"lab","namespace":"/service","scope":"beta"},"discoveryState":"DISCOVERED","managementState":"UNMANAGED","reachabilityState":"UNKNOWN","healthState":"UNKNOWN","revision":13,"memberCount":1,"leader":"beta-1"}]}}
